{
  "schema_version": 1,
  "bench_id": "iperf3-tcp",
  "bench_name": "iperf3 — TCP throughput (loopback)",
  "scenario": "server-throughput",
  "status": "pass",
  "started_at": "2026-07-04T23:55:29Z",
  "finished_at": "2026-07-04T23:55:40Z",
  "elapsed_seconds": 11.031842292,
  "value": 79.0,
  "unit": "numeric",
  "stdout": "79\n",
  "stderr": "",
  "exit_code": 0,
  "host": {
    "kernel": "7.0.14-arch1-1",
    "cpu_model": "13th Gen Intel(R) Core(TM) i7-13700HX",
    "dmi_board": "HP 8BC2",
    "battery_design_uwh": 70070000,
    "fingerprint": "700e5013535e9e96"
  }
}