{
  "schema_version": 1,
  "bench_id": "fio-seq-read",
  "bench_name": "fio — sequential read IOPS",
  "scenario": "server-throughput",
  "status": "pass",
  "started_at": "2026-07-04T23:55:27Z",
  "finished_at": "2026-07-04T23:55:28Z",
  "elapsed_seconds": 0.835812725,
  "value": 1524093.023256,
  "unit": "iops",
  "stdout": "",
  "stderr": "",
  "exit_code": 0,
  "host": {
    "kernel": "7.0.14-arch1-1",
    "cpu_model": "13th Gen Intel(R) Core(TM) i7-13700HX",
    "dmi_board": "HP 8BC2",
    "battery_design_uwh": 70070000,
    "fingerprint": "700e5013535e9e96"
  }
}